NAME, BILLING_ADDRESS, HOME_ADDRESS, LON, LAT
SMITH GARY R SMITH BETH R,77 WEDGEWOOD DRIVE WINTHROP ME 04364,77 WEDGEWOOD DRIVE, -69.9191676, 44.316207
ALEXANDER DONALD G ALEXANDER BARBARA R,83 WEDGEWOOD DRIVE WINTHROP ME 04364,83 WEDGEWOOD DRIVE, -69.9189368, 44.3170866
AMBURG STEPHEN B AMBURG JEANNE,51 WEDGEWOOD DRIVE WINTHROP ME 04364,51 WEDGEWOOD DRIVE, -69.9201679, 44.3148214
LUTRZYKOWSKI CHRISTOPHER J LUTRZYKOWSKI ELEANOR C,65 WEDGEWOOD DRIVE WINTHROP ME 04364,65 WEDGEWOOD DRIVE, -69.9195352, 44.3156548
LANEY JOHN MARK,43 WEDGEWOOD DRIVE WINTHROP ME 04364,43 WEDGEWOOD DRIVE, -69.9205547, 44.3142962
